{
  "version": "query_candidate_planner_operational_evaluation_dataset_v1",
  "datasetId": "beebeeai_query_candidate_cost_cache_latency_core_v1",
  "benchmarkMode": "SYNTHETIC_DETERMINISTIC_NO_PROVIDER_CALLS",
  "executions": [
    {
      "executionId": "scenario_01_cold",
      "scenarioId": "scenario_01",
      "phase": "COLD",
      "status": "SUCCESS",
      "latencyMs": 940,
      "expectedColdCostMicrousd": 240,
      "cache": {
        "readAttempted": true,
        "hit": false,
        "level": "MISS",
        "writeAttempted": true,
        "writeSucceeded": true
      },
      "provider": {
        "called": true,
        "modelId": "semantic_profiler_default",
        "inputTokens": 1000,
        "outputTokens": 200,
        "observedCostMicrousd": 240
      },
      "lifecycleContext": {
        "afterDownload": false,
        "afterReupload": false,
        "staleCacheReused": false
      }
    },
    {
      "executionId": "scenario_01_warm_1",
      "scenarioId": "scenario_01",
      "phase": "WARM",
      "status": "SUCCESS",
      "latencyMs": 46,
      "expectedColdCostMicrousd": 240,
      "cache": {
        "readAttempted": true,
        "hit": true,
        "level": "L1",
        "writeAttempted": false,
        "writeSucceeded": false
      },
      "provider": {
        "called": false,
        "modelId": "",
        "inputTokens": 0,
        "outputTokens": 0,
        "observedCostMicrousd": 0
      },
      "lifecycleContext": {
        "afterDownload": false,
        "afterReupload": false,
        "staleCacheReused": false
      }
    },
    {
      "executionId": "scenario_01_warm_2",
      "scenarioId": "scenario_01",
      "phase": "WARM",
      "status": "SUCCESS",
      "latencyMs": 56,
      "expectedColdCostMicrousd": 240,
      "cache": {
        "readAttempted": true,
        "hit": true,
        "level": "L3",
        "writeAttempted": false,
        "writeSucceeded": false
      },
      "provider": {
        "called": false,
        "modelId": "",
        "inputTokens": 0,
        "outputTokens": 0,
        "observedCostMicrousd": 0
      },
      "lifecycleContext": {
        "afterDownload": false,
        "afterReupload": false,
        "staleCacheReused": false
      }
    },
    {
      "executionId": "scenario_01_download_reuse",
      "scenarioId": "scenario_01",
      "phase": "DOWNLOAD_REUSE",
      "status": "SUCCESS",
      "latencyMs": 70,
      "expectedColdCostMicrousd": 240,
      "cache": {
        "readAttempted": true,
        "hit": true,
        "level": "L4",
        "writeAttempted": false,
        "writeSucceeded": false
      },
      "provider": {
        "called": false,
        "modelId": "",
        "inputTokens": 0,
        "outputTokens": 0,
        "observedCostMicrousd": 0
      },
      "lifecycleContext": {
        "afterDownload": true,
        "afterReupload": false,
        "staleCacheReused": false
      }
    },
    {
      "executionId": "scenario_01_reupload",
      "scenarioId": "scenario_01",
      "phase": "REUPLOAD",
      "status": "SUCCESS",
      "latencyMs": 1075,
      "expectedColdCostMicrousd": 246,
      "cache": {
        "readAttempted": true,
        "hit": false,
        "level": "MISS",
        "writeAttempted": true,
        "writeSucceeded": true
      },
      "provider": {
        "called": true,
        "modelId": "semantic_profiler_default",
        "inputTokens": 1020,
        "outputTokens": 205
      },
      "lifecycleContext": {
        "afterDownload": false,
        "afterReupload": true,
        "staleCacheReused": false
      }
    },
    {
      "executionId": "scenario_02_cold",
      "scenarioId": "scenario_02",
      "phase": "COLD",
      "status": "SUCCESS",
      "latencyMs": 1000,
      "expectedColdCostMicrousd": 252,
      "cache": {
        "readAttempted": true,
        "hit": false,
        "level": "MISS",
        "writeAttempted": true,
        "writeSucceeded": true
      },
      "provider": {
        "called": true,
        "modelId": "semantic_profiler_default",
        "inputTokens": 1050,
        "outputTokens": 210
      },
      "lifecycleContext": {
        "afterDownload": false,
        "afterReupload": false,
        "staleCacheReused": false
      }
    },
    {
      "executionId": "scenario_02_warm_1",
      "scenarioId": "scenario_02",
      "phase": "WARM",
      "status": "SUCCESS",
      "latencyMs": 54,
      "expectedColdCostMicrousd": 252,
      "cache": {
        "readAttempted": true,
        "hit": true,
        "level": "L2",
        "writeAttempted": false,
        "writeSucceeded": false
      },
      "provider": {
        "called": false,
        "modelId": "",
        "inputTokens": 0,
        "outputTokens": 0,
        "observedCostMicrousd": 0
      },
      "lifecycleContext": {
        "afterDownload": false,
        "afterReupload": false,
        "staleCacheReused": false
      }
    },
    {
      "executionId": "scenario_02_warm_2",
      "scenarioId": "scenario_02",
      "phase": "WARM",
      "status": "SUCCESS",
      "latencyMs": 64,
      "expectedColdCostMicrousd": 252,
      "cache": {
        "readAttempted": true,
        "hit": true,
        "level": "L4",
        "writeAttempted": false,
        "writeSucceeded": false
      },
      "provider": {
        "called": false,
        "modelId": "",
        "inputTokens": 0,
        "outputTokens": 0,
        "observedCostMicrousd": 0
      },
      "lifecycleContext": {
        "afterDownload": false,
        "afterReupload": false,
        "staleCacheReused": false
      }
    },
    {
      "executionId": "scenario_02_download_reuse",
      "scenarioId": "scenario_02",
      "phase": "DOWNLOAD_REUSE",
      "status": "SUCCESS",
      "latencyMs": 76,
      "expectedColdCostMicrousd": 252,
      "cache": {
        "readAttempted": true,
        "hit": true,
        "level": "L4",
        "writeAttempted": false,
        "writeSucceeded": false
      },
      "provider": {
        "called": false,
        "modelId": "",
        "inputTokens": 0,
        "outputTokens": 0,
        "observedCostMicrousd": 0
      },
      "lifecycleContext": {
        "afterDownload": true,
        "afterReupload": false,
        "staleCacheReused": false
      }
    },
    {
      "executionId": "scenario_02_reupload",
      "scenarioId": "scenario_02",
      "phase": "REUPLOAD",
      "status": "SUCCESS",
      "latencyMs": 1130,
      "expectedColdCostMicrousd": 258,
      "cache": {
        "readAttempted": true,
        "hit": false,
        "level": "MISS",
        "writeAttempted": true,
        "writeSucceeded": true
      },
      "provider": {
        "called": true,
        "modelId": "semantic_profiler_default",
        "inputTokens": 1070,
        "outputTokens": 215,
        "observedCostMicrousd": 258
      },
      "lifecycleContext": {
        "afterDownload": false,
        "afterReupload": true,
        "staleCacheReused": false
      }
    },
    {
      "executionId": "scenario_03_cold",
      "scenarioId": "scenario_03",
      "phase": "COLD",
      "status": "SUCCESS",
      "latencyMs": 1060,
      "expectedColdCostMicrousd": 264,
      "cache": {
        "readAttempted": true,
        "hit": false,
        "level": "MISS",
        "writeAttempted": true,
        "writeSucceeded": true
      },
      "provider": {
        "called": true,
        "modelId": "semantic_profiler_default",
        "inputTokens": 1100,
        "outputTokens": 220,
        "observedCostMicrousd": 264
      },
      "lifecycleContext": {
        "afterDownload": false,
        "afterReupload": false,
        "staleCacheReused": false
      }
    },
    {
      "executionId": "scenario_03_warm_1",
      "scenarioId": "scenario_03",
      "phase": "WARM",
      "status": "SUCCESS",
      "latencyMs": 62,
      "expectedColdCostMicrousd": 264,
      "cache": {
        "readAttempted": true,
        "hit": true,
        "level": "L3",
        "writeAttempted": false,
        "writeSucceeded": false
      },
      "provider": {
        "called": false,
        "modelId": "",
        "inputTokens": 0,
        "outputTokens": 0,
        "observedCostMicrousd": 0
      },
      "lifecycleContext": {
        "afterDownload": false,
        "afterReupload": false,
        "staleCacheReused": false
      }
    },
    {
      "executionId": "scenario_03_warm_2",
      "scenarioId": "scenario_03",
      "phase": "WARM",
      "status": "SUCCESS",
      "latencyMs": 72,
      "expectedColdCostMicrousd": 264,
      "cache": {
        "readAttempted": true,
        "hit": true,
        "level": "L3",
        "writeAttempted": false,
        "writeSucceeded": false
      },
      "provider": {
        "called": false,
        "modelId": "",
        "inputTokens": 0,
        "outputTokens": 0,
        "observedCostMicrousd": 0
      },
      "lifecycleContext": {
        "afterDownload": false,
        "afterReupload": false,
        "staleCacheReused": false
      }
    },
    {
      "executionId": "scenario_03_download_reuse",
      "scenarioId": "scenario_03",
      "phase": "DOWNLOAD_REUSE",
      "status": "SUCCESS",
      "latencyMs": 82,
      "expectedColdCostMicrousd": 264,
      "cache": {
        "readAttempted": true,
        "hit": true,
        "level": "L4",
        "writeAttempted": false,
        "writeSucceeded": false
      },
      "provider": {
        "called": false,
        "modelId": "",
        "inputTokens": 0,
        "outputTokens": 0,
        "observedCostMicrousd": 0
      },
      "lifecycleContext": {
        "afterDownload": true,
        "afterReupload": false,
        "staleCacheReused": false
      }
    },
    {
      "executionId": "scenario_03_reupload",
      "scenarioId": "scenario_03",
      "phase": "REUPLOAD",
      "status": "SUCCESS",
      "latencyMs": 1185,
      "expectedColdCostMicrousd": 270,
      "cache": {
        "readAttempted": true,
        "hit": false,